### ISSUE TITLE
Add some sort of timeout to underlying HTTP connection

### ISSUE THREAD

**Issue by itsmemattchung** [kkamkou/node-akamai-http-api#5]
I incorrectly used the hostname defined under config->nestorage instead of what is defined under *NetStorage API Information*.  I couldn't figure out why it was hanging so I did a `tcpdump` and it looks like the client just sits there trying to open up a socket to the defined hostname.

```
14:40:24.571344 IP vagrant-ubuntu-trusty-64.59682 > xxxxxx.upload.akamai.com.http: Flags [S], seq 525786748, win 29200, options [mss 1460,sackOK,TS val 3168164 ecr 0,nop,wscale 6], length 0
14:40:27.832970 IP vagrant-ubuntu-trusty-64.59683 > xxxxxx.upload.akamai.com.http: Flags [S], seq 1323830723, win 29200, options [mss 1460,sackOK,TS val 3168979 ecr 0,nop,wscale 6], length 0
14:40:28.831789 IP vagrant-ubuntu-trusty-64.59683 > xxxxxx.upload.akamai.com.http: Flags [S], seq 1323830723, win 29200, options [mss 1460,sackOK,TS val 3169229 ecr 0,nop,wscale 6], length 0
14:40:30.834117 IP vagrant-ubuntu-trusty-64.59683 > xxxxxx.upload.akamai.com.http: Flags [S], seq 1323830723, win 29200, options [mss 1460,sackOK,TS val 3169730 ecr 0,nop,wscale 6], length 0
14:40:34.841933 IP vagrant-ubuntu-trusty-64.59683 > xxxxxx.upload.akamai.com.http: Flags [S], seq 1323830723, win 29200, options [mss 1460,sackOK,TS val 3170732 ecr 0,nop,wscale 6], length 0
14:40:42.859291 IP vagrant-ubuntu-trusty-64.59683 > xxxxxx.upload.akamai.com.http: Flags [S], seq 1323830723, win 29200, options [mss 1460,sackOK,TS val 3172736 ecr 0,nop,wscale 6], length 0
14:40:58.890233 IP vagrant-ubuntu-trusty-64.59683 > xxxxxx.upload.akamai.com.http: Flags [S], seq 1323830723, win 29200, options [mss 1460,sackOK,TS val 3176744 ecr 0,nop,wscale 6], length 0
```

## Update to README
If it's cool, I'll update the README so people don't run into the same issue

**Comment by kkamkou** [comment]
Hi Matt! Could you repeat your step and wait for the disconnect. I think it should be in ~3 mins. I'm curious how much time it'll take for you. Also, please copy-paste the exception itself.

**Comment by kkamkou** [comment]
@itsmemattchung please, review the changes I made.

**Comment by itsmemattchung** [comment]
Will take a look thanks @kkamkou .

**Comment by itsmemattchung** [comment]
@kkamkou just tested out the changes. Looks good. Here was the sample code before that was causing it to hang:

```javascript
var akamai = require('akamai-http-api');

akamai.setConfig({
  keyName: process.env.AKAMAI_KEY_NAME,
  key: process.env.AKAMAI_KEY,
  host: '4.2.2.2'
});

akamai.dir('/', function(err,data){
  if(err){
    throw new Error("Unable to dir directory");
  }
    console.log(data);
})
```
